{
  "slug": "ramya-karthik-x7q2",
  "template": "kanjeevaram-gold",
  "variant": "maroon-gold",
  "occasion": "wedding",
  "default_lang": "ta",
  "langs": ["ta", "en", "hi"],
  "watermark": true,
  "package": "web",
  "blessing": {
    "ta": "ஸ்ரீ விநாயகர் துணை",
    "en": "With the blessings of Lord Vinayaka",
    "hi": "श्री विनायक जी के आशीर्वाद से"
  },
  "hosts": {
    "primary": { "ta": "ரம்யா", "en": "Ramya", "hi": "रम्या" },
    "secondary": { "ta": "கார்த்திக்", "en": "Karthik", "hi": "कार्तिक" },
    "family_line": {
      "ta": "திரு. சு. முருகன் – திருமதி மு. லட்சுமி அவர்களின் மகள் · திரு. ரா. செந்தில் – திருமதி செ. மீனாட்சி அவர்களின் மகன்",
      "en": "Daughter of Mr. S. Murugan & Mrs. M. Lakshmi · Son of Mr. R. Senthil & Mrs. S. Meenakshi",
      "hi": "श्री एस. मुरुगन एवं श्रीमती एम. लक्ष्मी की सुपुत्री · श्री आर. सेंथिल एवं श्रीमती एस. मीनाक्षी के सुपुत्र"
    }
  },
  "intro": {
    "ta": "இருவீட்டாரும் இணைந்து நடத்தும் திருமண விழாவிற்குத் தாங்கள் குடும்பத்துடன் வருகை தந்து மணமக்களை வாழ்த்த அன்புடன் அழைக்கிறோம்.",
    "en": "Together with our families, we joyfully invite you and your family to bless the couple at their wedding.",
    "hi": "दोनों परिवारों की ओर से आपको सपरिवार विवाह समारोह में पधारकर वर-वधू को आशीर्वाद देने हेतु सादर आमंत्रित करते हैं।"
  },
  "events": [
    {
      "id": "nichayathartham",
      "title": { "ta": "நிச்சயதார்த்தம்", "en": "Nichayathartham (Engagement)", "hi": "निश्चयतार्थम (सगाई)" },
      "start": "2026-12-10T18:00:00+05:30",
      "end": "2026-12-10T21:00:00+05:30",
      "venue": {
        "name": { "ta": "ஸ்ரீ லட்சுமி மஹால்", "en": "Sri Lakshmi Mahal", "hi": "श्री लक्ष्मी महल" },
        "address": {
          "ta": "திருவனந்தபுரம் சாலை, பாளையங்கோட்டை, திருநெல்வேலி",
          "en": "Trivandrum Road, Palayamkottai, Tirunelveli",
          "hi": "त्रिवेंद्रम रोड, पालयमकोट्टई, तिरुनेलवेली"
        },
        "maps_url": "https://maps.google.com/?q=Palayamkottai+Tirunelveli"
      },
      "dress_code": {
        "label": { "ta": "பச்சை நிற ஆடைகள்", "en": "Shades of green", "hi": "हरे रंग के परिधान" },
        "colour": "#2E7D32"
      }
    },
    {
      "id": "muhurtham",
      "title": { "ta": "திருமண முகூர்த்தம்", "en": "Muhurtham (Wedding)", "hi": "मुहूर्तम (विवाह)" },
      "start": "2026-12-11T06:00:00+05:30",
      "end": "2026-12-11T07:30:00+05:30",
      "traditional_date": { "ta": "கார்த்திகை 25", "en": "Karthigai 25", "hi": "कार्तिगै 25" },
      "venue": {
        "name": { "ta": "ஸ்ரீ லட்சுமி மஹால்", "en": "Sri Lakshmi Mahal", "hi": "श्री लक्ष्मी महल" },
        "address": {
          "ta": "திருவனந்தபுரம் சாலை, பாளையங்கோட்டை, திருநெல்வேலி",
          "en": "Trivandrum Road, Palayamkottai, Tirunelveli",
          "hi": "त्रिवेंद्रम रोड, पालयमकोट्टई, तिरुनेलवेली"
        },
        "maps_url": "https://maps.google.com/?q=Palayamkottai+Tirunelveli"
      },
      "dress_code": {
        "label": { "ta": "பாரம்பரிய பட்டு – அரக்கு & தங்கம்", "en": "Traditional silk – maroon & gold", "hi": "पारंपरिक रेशम – मैरून और सुनहरा" },
        "colour": "#7B1E24"
      }
    },
    {
      "id": "reception",
      "title": { "ta": "வரவேற்பு", "en": "Reception", "hi": "स्वागत समारोह" },
      "start": "2026-12-11T18:30:00+05:30",
      "end": "2026-12-11T21:30:00+05:30",
      "venue": {
        "name": { "ta": "நெல்லை ரெசிடென்சி விருந்து அரங்கம்", "en": "Nellai Residency Banquet Hall", "hi": "नेल्लै रेज़िडेंसी बैंक्वेट हॉल" },
        "address": {
          "ta": "தெற்கு புறவழிச் சாலை, திருநெல்வேலி",
          "en": "South Bypass Road, Tirunelveli",
          "hi": "साउथ बाईपास रोड, तिरुनेलवेली"
        },
        "maps_url": "https://maps.google.com/?q=South+Bypass+Road+Tirunelveli"
      },
      "dress_code": {
        "label": { "ta": "இளம் வண்ணங்கள்", "en": "Pastels", "hi": "हल्के रंग" },
        "colour": "#E8A0B4"
      }
    }
  ],
  "countdown_to": "muhurtham",
  "photos": [
    { "src": "photos/01.jpg", "alt": { "ta": "ரம்யா மற்றும் கார்த்திக்", "en": "Ramya and Karthik", "hi": "रम्या और कार्तिक" } },
    { "src": "photos/02.jpg", "alt": { "ta": "நிச்சயதார்த்த நினைவுகள்", "en": "Engagement memories", "hi": "सगाई की यादें" } },
    { "src": "photos/03.jpg", "alt": { "ta": "குடும்பத்துடன்", "en": "With family", "hi": "परिवार के साथ" } },
    { "src": "photos/04.jpg", "alt": { "ta": "புன்னகை தருணம்", "en": "A happy moment", "hi": "एक खुशी का पल" } }
  ],
  "music": { "file": "assets/music/placeholder-pluck.mp3", "start_at_sec": 0 },
  "voice_welcome": null,
  "contacts": [
    { "label": { "ta": "மணமகள் வீட்டார்", "en": "Bride's family", "hi": "वधू पक्ष" }, "whatsapp": "+919000000001", "phone": "+919000000001" },
    { "label": { "ta": "மணமகன் வீட்டார்", "en": "Groom's family", "hi": "वर पक्ष" }, "whatsapp": "+919000000002", "phone": "+919000000002" }
  ],
  "rsvp": { "enabled": true, "endpoint": "https://script.google.com/macros/s/XXXX/exec", "deadline": "2026-12-01", "max_guests": 10 },
  "closing": {
    "ta": "உற்றார், உறவினர், நண்பர்கள் அனைவரின் வாழ்த்துகளுடன்",
    "en": "With best compliments from all our relatives and friends",
    "hi": "सभी सगे-संबंधियों और मित्रों की शुभकामनाओं सहित"
  },
  "guest_personalisation": true,
  "og": { "title": "Ramya weds Karthik · 11 Dec 2026", "description": "Tap to open the invitation" }
}
